{
  "schemaVersion": 1,
  "chainId": 42161,
  "network": "Arbitrum One",
  "generatedAt": "2026-10-30T07:51:55Z",
  "tokens": [
    {
      "address": "0xff970a61a04b1ca14834a43f5de4533ebddb5cc8",
      "name": "Bridged USDC",
      "symbol": "USDC.e",
      "decimals": 6,
      "metadataExpirySeconds": 86400
    },
    {
      "address": "0xfc5a1a6eb076a2c7ad06ed22c90d7e710e35ad0a",
      "name": "GMX",
      "symbol": "GMX",
      "decimals": 18,
      "metadataExpirySeconds": 86400
    },
    {
      "address": "0xcbb7c0000ab88b473b1f5afd9ef808440eed33bf",
      "name": "Coinbase Wrapped BTC",
      "symbol": "cbBTC",
      "decimals": 8,
      "metadataExpirySeconds": 86400
    },
    {
      "address": "0xfd086bc7cd5c481dcc9c85ebe478a1c0b69fcbb9",
      "name": "USDT0",
      "symbol": "USDT0",
      "decimals": 6,
      "metadataExpirySeconds": 86400
    },
    {
      "address": "0x004b506865409877c9fa29bfb1eba929984b9bbc",
      "name": "Global Dollar",
      "symbol": "USDG",
      "decimals": 6,
      "metadataExpirySeconds": 86400
    },
    {
      "address": "0xaf88d065e77c8cc2239327c5edb3a432268e5831",
      "name": "USD Coin",
      "symbol": "USDC",
      "decimals": 6,
      "metadataExpirySeconds": 86400
    },
    {
      "address": "0x2416092f143378750bb29b79ed961ab195cceea5",
      "name": "Renzo Restaked ETH",
      "symbol": "ezETH",
      "decimals": 18,
      "metadataExpirySeconds": 86400
    },
    {
      "address": "0x4186bfc76e2e237523cbc30fd220fe055156b41f",
      "name": "KelpDao Restaked ETH",
      "symbol": "rsETH",
      "decimals": 18,
      "metadataExpirySeconds": 86400
    },
    {
      "address": "0xfa7f8980b0f1e64a2062791cc3b0871572f1f7f0",
      "name": "Uniswap",
      "symbol": "UNI",
      "decimals": 18,
      "metadataExpirySeconds": 86400
    },
    {
      "address": "0xf97f4df75117a78c1a5a0dbb814af92458539fb4",
      "name": "Chainlink",
      "symbol": "LINK",
      "decimals": 18,
      "metadataExpirySeconds": 86400
    },
    {
      "address": "0xba5ddd1f9d7f570dc94a51479a000e3bce967196",
      "name": "Aave",
      "symbol": "AAVE",
      "decimals": 18,
      "metadataExpirySeconds": 86400
    },
    {
      "address": "0x6491c05a82219b8d1479057361ff1654749b876b",
      "name": "USDS",
      "symbol": "USDS",
      "decimals": 18,
      "metadataExpirySeconds": 86400
    },
    {
      "address": "0x912ce59144191c1204e64559fe8253a0e49e6548",
      "name": "Arbitrum",
      "symbol": "ARB",
      "decimals": 18,
      "metadataExpirySeconds": 86400
    },
    {
      "address": "0x82af49447d8a07e3bd95bd0d56f35241523fbab1",
      "name": "Arbitrum Bridged WETH (Arbitrum One)",
      "symbol": "WETH",
      "decimals": 18,
      "metadataExpirySeconds": 86400
    },
    {
      "address": "0x46850ad61c2b7d64d08c9c754f45254596696984",
      "name": "PayPal USD",
      "symbol": "PYUSD",
      "decimals": 6,
      "metadataExpirySeconds": 86400
    },
    {
      "address": "0x2f2a2543b76a4166549f7aab2e75bef0aefc5b0f",
      "name": "Arbitrum Bridged WBTC (Arbitrum One)",
      "symbol": "WBTC",
      "decimals": 8,
      "metadataExpirySeconds": 86400
    },
    {
      "address": "0x5d3a1ff2b6bab83b63cd9ad0787074081a52ef34",
      "name": "Ethena USDe",
      "symbol": "USDE",
      "decimals": 18,
      "metadataExpirySeconds": 86400
    },
    {
      "address": "0x13ad51ed4f1b7e9dc168d8a00cb3f4ddd85efa60",
      "name": "Lido DAO",
      "symbol": "LDO",
      "decimals": 18,
      "metadataExpirySeconds": 86400
    },
    {
      "address": "0x0c880f6761f1af8d9aa9c466984b80dab9a8c9e8",
      "name": "Pendle",
      "symbol": "PENDLE",
      "decimals": 18,
      "metadataExpirySeconds": 86400
    },
    {
      "address": "0x211cc4dd073734da055fbf44a2b4667d5e5fe5d2",
      "name": "Ethena Staked USDe",
      "symbol": "SUSDE",
      "decimals": 18,
      "metadataExpirySeconds": 86400
    },
    {
      "address": "0x40bd670a58238e6e230c430bbb5ce6ec0d40df48",
      "name": "Morpho",
      "symbol": "MORPHO",
      "decimals": 18,
      "metadataExpirySeconds": 86400
    },
    {
      "address": "0x1debd73e752beaf79865fd6446b0c970eae7732f",
      "name": "Coinbase Wrapped Staked ETH",
      "symbol": "CBETH",
      "decimals": 18,
      "metadataExpirySeconds": 86400
    },
    {
      "address": "0x7dff72693f6a4149b17e7c6314655f6a9f7c8b33",
      "name": "GHO",
      "symbol": "GHO",
      "decimals": 18,
      "metadataExpirySeconds": 86400
    },
    {
      "address": "0xddb46999f8891663a8f2828d25298f70416d7610",
      "name": "sUSDS",
      "symbol": "SUSDS",
      "decimals": 18,
      "metadataExpirySeconds": 86400
    },
    {
      "address": "0x17fc002b466eec40dae837fc4be5c67993ddbd6f",
      "name": "Legacy Frax Dollar",
      "symbol": "FRAX",
      "decimals": 18,
      "metadataExpirySeconds": 86400
    },
    {
      "address": "0x93b346b6bc2548da6a1e7d98e9a421b42541425b",
      "name": "Liquity USD",
      "symbol": "LUSD",
      "decimals": 18,
      "metadataExpirySeconds": 86400
    },
    {
      "address": "0xb766039cc6db368759c1e56b79affe831d0cc507",
      "name": "Rocket Pool",
      "symbol": "RPL",
      "decimals": 18,
      "metadataExpirySeconds": 86400
    },
    {
      "address": "0x5979d7b546e38e414f7e9822514be443a4800529",
      "name": "Arbitrum Bridged wstETH (Arbitrum)",
      "symbol": "WSTETH",
      "decimals": 18,
      "metadataExpirySeconds": 86400
    },
    {
      "address": "0xda10009cbd5d07dd0cecc66161fc93d7c9000da1",
      "name": "MakerDAO Arbitrum Bridged DAI (Arbitrum One)",
      "symbol": "DAI",
      "decimals": 18,
      "metadataExpirySeconds": 86400
    },
    {
      "address": "0xec70dcb4a1efa46b8f2d97c310c9c4790ba5ffa8",
      "name": "Rocket Pool ETH",
      "symbol": "RETH",
      "decimals": 18,
      "metadataExpirySeconds": 86400
    },
    {
      "address": "0x35751007a407ca6feffe80b3cb397736d2cf4dbe",
      "name": "Arbitrum Bridged Wrapped eETH (Arbitrum)",
      "symbol": "WEETH",
      "decimals": 18,
      "metadataExpirySeconds": 86400
    },
    {
      "address": "0x25d887ce7a35172c62febfd67a1856f20faebb00",
      "name": "Pepe",
      "symbol": "PEPE",
      "decimals": 18,
      "metadataExpirySeconds": 86400
    },
    {
      "address": "0x58538e6a46e07434d7e7375bc268d3cb839c0133",
      "name": "Ethena",
      "symbol": "ENA",
      "decimals": 18,
      "metadataExpirySeconds": 86400
    },
    {
      "address": "0x93c9932e4afa59201f0b5e63f7d816516f1669fe",
      "name": "First Digital USD",
      "symbol": "FDUSD",
      "decimals": 18,
      "metadataExpirySeconds": 86400
    },
    {
      "address": "0x498bf2b1e120fed3ad3d42ea2165e9b73f99c1e5",
      "name": "crvUSD",
      "symbol": "CRVUSD",
      "decimals": 18,
      "metadataExpirySeconds": 86400
    },
    {
      "address": "0x6985884c4392d348587b19cb9eaaf157f13271cd",
      "name": "LayerZero",
      "symbol": "ZRO",
      "decimals": 18,
      "metadataExpirySeconds": 86400
    },
    {
      "address": "0x11cdb42b0eb46d95f990bedd4695a6e3fa034978",
      "name": "Curve DAO",
      "symbol": "CRV",
      "decimals": 18,
      "metadataExpirySeconds": 86400
    },
    {
      "address": "0x7189fb5b6504bbff6a852b13b7b82a3c118fdc27",
      "name": "Ether.fi",
      "symbol": "ETHFI",
      "decimals": 18,
      "metadataExpirySeconds": 86400
    },
    {
      "address": "0x1b896893dfc86bb67cf57767298b9073d2c1ba2c",
      "name": "PancakeSwap",
      "symbol": "CAKE",
      "decimals": 18,
      "metadataExpirySeconds": 86400
    },
    {
      "address": "0x09199d9a5f4448d0848e4395d065e1ad9c4a1f74",
      "name": "Bonk",
      "symbol": "BONK",
      "decimals": 5,
      "metadataExpirySeconds": 86400
    },
    {
      "address": "0x12c2de43878fb1a06c1ead481f11e0c693a719c7",
      "name": "DGrid AI",
      "symbol": "DGAI",
      "decimals": 18,
      "metadataExpirySeconds": 86400
    },
    {
      "address": "0x6314c31a7a1652ce482cffe247e9cb7c3f4bb9af",
      "name": "1INCH",
      "symbol": "1INCH",
      "decimals": 18,
      "metadataExpirySeconds": 86400
    },
    {
      "address": "0x00312400303d02c323295f6e8b7309bc30fb6bce",
      "name": "Caldera",
      "symbol": "ERA",
      "decimals": 18,
      "metadataExpirySeconds": 86400
    },
    {
      "address": "0x80eede496655fb9047dd39d9f418d5483ed600df",
      "name": "Frax USD",
      "symbol": "FRXUSD",
      "decimals": 18,
      "metadataExpirySeconds": 86400
    },
    {
      "address": "0x76ce01f0ef25aa66cc5f1e546a005e4a63b25609",
      "name": "Re Protocol reUSD",
      "symbol": "REUSD",
      "decimals": 18,
      "metadataExpirySeconds": 86400
    },
    {
      "address": "0x0c1c1c109fe34733fca54b82d7b46b75cfb71f6e",
      "name": "USD.AI",
      "symbol": "CHIP",
      "decimals": 18,
      "metadataExpirySeconds": 86400
    },
    {
      "address": "0x354a6da3fcde098f8389cad84b0182725c6c91de",
      "name": "Compound",
      "symbol": "COMP",
      "decimals": 18,
      "metadataExpirySeconds": 86400
    },
    {
      "address": "0xa68ec98d7ca870cf1dd0b00ebbb7c4bf60a8e74d",
      "name": "Biconomy",
      "symbol": "BICO",
      "decimals": 18,
      "metadataExpirySeconds": 86400
    },
    {
      "address": "0x0b2b2b2076d95dda7817e785989fe353fe955ef9",
      "name": "Staked USDai",
      "symbol": "SUSDAI",
      "decimals": 18,
      "metadataExpirySeconds": 86400
    },
    {
      "address": "0x25118290e6a5f4139381d072181157035864099d",
      "name": "Rain",
      "symbol": "RAIN",
      "decimals": 18,
      "metadataExpirySeconds": 86400
    },
    {
      "address": "0xd58d345fd9c82262e087d2d0607624b410d88242",
      "name": "Tellor Tributes",
      "symbol": "TRB",
      "decimals": 18,
      "metadataExpirySeconds": 86400
    },
    {
      "address": "0x6c84a8f1c29108f47a79964b5fe888d4f4d0de40",
      "name": "tBTC",
      "symbol": "TBTC",
      "decimals": 18,
      "metadataExpirySeconds": 86400
    },
    {